{
  "$schema": "bundle.schema.json",
  "info": {
    "name": "SwayFX",
    "desc": "Compiles swayfx from source for openSUSE.",
    "icon": "\uF35D"
  },
  "zypper": [
    "git",
    "gcc",
    "gcc-c++",
    "meson",
    "ninja",
    "make",
    "scdoc",
    "pkgconf-pkg-config",
    "wayland-devel",
    "wayland-protocols-devel",
    "libinput-devel",
    "libevdev-devel",
    "libdrm-devel",
    "libgbm-devel",
    "libxkbcommon-devel",
    "libxcb-devel",
    "systemd-devel",
    "Mesa-libEGL-devel",
    "Mesa-libGLESv2-devel",
    "Mesa-dri",
    "xwayland-devel",
    "libpixman-1-0-devel",
    "pango-devel",
    "cairo-devel",
    "gdk-pixbuf-devel",
    "pcre2-devel",
    "libjson-c-devel",
    "hwdata",
    "pam-devel",
    "libpcap-devel",
    "libliftoff-devel"
  ],
  "pre": [
    "rm -rf /tmp/wlroots-build /tmp/scenefx-build /tmp/swayfx-build"
  ],
  "post": [
    "git clone -b 0.19.3 https://gitlab.freedesktop.org/wlroots/wlroots.git /tmp/wlroots-build",
    "cd /tmp/wlroots-build",
    "meson setup build --prefix=/usr",
    "sudo ninja -C build install",
    "git clone -b 0.4.1 https://github.com/wlrfx/scenefx.git /tmp/scenefx-build",
    "cd /tmp/scenefx-build",
    "meson setup build --prefix=/usr",
    "sudo ninja -C build install",
    "git clone -b 0.5.3 https://github.com/WillPower3309/swayfx.git /tmp/swayfx-build",
    "cd /tmp/swayfx-build",
    "meson setup build --prefix=/usr",
    "sudo ninja -C build install"
  ]
}
